<?xml version="1.0" encoding="UTF-8"?>
<rift_locations xmlns:xsi="http://www.w3.org/2001/XMLSchema-instance" xsi:noNamespaceSchemaLocation="rift_locations.xsd">
	<rift_location id="2140" world="210040000" />
	<rift_location id="2141" world="210040000" />
	<rift_location id="2142" world="210040000" />
	<rift_location id="2143" world="210040000" />
	<rift_location id="2144" world="210040000" />
	<rift_location id="2145" world="210040000" />
	<rift_location id="2146" world="210040000" />
	<rift_location id="2150" world="210050000" />
	<rift_location id="2151" world="210050000" />
	<rift_location id="2152" world="210050000" />
	<rift_location id="2153" world="210050000" />
	<rift_location id="2170" world="210070000" /> <!-- Cygnea -->
	<rift_location id="2171" world="210070000" /> <!-- Cygnea -->
	<rift_location id="2172" world="210070000" /> <!-- Cygnea -->
	<rift_location id="2173" world="210070000" /> <!-- Cygnea -->
	<rift_location id="2174" world="210070000" /> <!-- Cygnea -->
	<rift_location id="2175" world="210070000" /> <!-- Cygnea -->
	<rift_location id="2176" world="210070000" /> <!-- Cygnea -->
	<rift_location id="2177" world="210070000" /> <!-- Cygnea -->
	<rift_location id="2178" world="210070000" /> <!-- Cygnea -->
	<rift_location id="2240" world="220040000" />
	<rift_location id="2241" world="220040000" />
	<rift_location id="2242" world="220040000" />
	<rift_location id="2243" world="220040000" />
	<rift_location id="2244" world="220040000" />
	<rift_location id="2245" world="220040000" />
	<rift_location id="2246" world="220040000" />
	<rift_location id="2270" world="220070000" />
	<rift_location id="2271" world="220070000" />
	<rift_location id="2272" world="220070000" />
	<rift_location id="2273" world="220070000" />
	<rift_location id="2280" world="220080000" /> <!-- Enshar -->
	<rift_location id="2281" world="220080000" /> <!-- Enshar -->
	<rift_location id="2282" world="220080000" /> <!-- Enshar -->
	<rift_location id="2283" world="220080000" /> <!-- Enshar -->
	<rift_location id="2284" world="220080000" /> <!-- Enshar -->
	<rift_location id="2285" world="220080000" /> <!-- Enshar -->
	<rift_location id="2286" world="220080000" /> <!-- Enshar -->
	<rift_location id="2287" world="220080000" /> <!-- Enshar -->
	<rift_location id="2288" world="220080000" /> <!-- Enshar -->
</rift_locations>